Trial 191 finished with value: 0.5767857142857145 and parameters: {'n_estimators': 1347, 'max_depth': 1749, 'min_samples_split': 10, 'min_samples_leaf': 3, 'criterion': 'entropy'}. Best is trial 163 with value: 0.596904761904762.
Trial 192 finished with value: 0.584404761904762 and parameters: {'n_estimators': 1299, 'max_depth': 1665, 'min_samples_split': 10, 'min_samples_leaf': 2, 'criterion': 'entropy'}. Best is trial 163 with value: 0.596904761904762.
Trial 193 finished with value: 0.5745238095238095 and parameters: {'n_estimators': 1271, 'max_depth': 1697, 'min_samples_split': 10, 'min_samples_leaf': 1, 'criterion': 'entropy'}. Best is trial 163 with value: 0.596904761904762.
Trial 194 finished with value: 0.5797619047619047 and parameters: {'n_estimators': 1387, 'max_depth': 1732, 'min_samples_split': 10, 'min_samples_leaf': 1, 'criterion': 'entropy'}. Best is trial 163 with value: 0.596904761904762.
Trial 195 finished with value: 0.5892857142857142 and parameters: {'n_estimators': 1325, 'max_depth': 1866, 'min_samples_split': 9, 'min_samples_leaf': 3, 'criterion': 'entropy'}. Best is trial 163 with value: 0.596904761904762.
Trial 196 finished with value: 0.5797619047619048 and parameters: {'n_estimators': 1440, 'max_depth': 1767, 'min_samples_split': 11, 'min_samples_leaf': 1, 'criterion': 'entropy'}. Best is trial 163 with value: 0.596904761904762.
Trial 197 finished with value: 0.5942857142857142 and parameters: {'n_estimators': 2039, 'max_depth': 1224, 'min_samples_split': 12, 'min_samples_leaf': 2, 'criterion': 'entropy'}. Best is trial 163 with value: 0.596904761904762.
Trial 198 finished with value: 0.5847619047619048 and parameters: {'n_estimators': 1993, 'max_depth': 1268, 'min_samples_split': 12, 'min_samples_leaf': 1, 'criterion': 'entropy'}. Best is trial 163 with value: 0.596904761904762.
Trial 199 finished with value: 0.5722619047619049 and parameters: {'n_estimators': 166, 'max_depth': 1218, 'min_samples_split': 8, 'min_samples_leaf': 1, 'criterion': 'entropy'}. Best is trial 163 with value: 0.596904761904762.
Trial 200 finished with value: 0.5669047619047619 and parameters: {'n_estimators': 2021, 'max_depth': 1104, 'min_samples_split': 11, 'min_samples_leaf': 4, 'criterion': 'entropy'}. Best is trial 163 with value: 0.596904761904762.
Trial 201 finished with value: 0.5944047619047619 and parameters: {'n_estimators': 2028, 'max_depth': 1376, 'min_samples_split': 12, 'min_samples_leaf': 2, 'criterion': 'entropy'}. Best is trial 163 with value: 0.596904761904762.
Trial 202 finished with value: 0.5821428571428571 and parameters: {'n_estimators': 2031, 'max_depth': 1313, 'min_samples_split': 12, 'min_samples_leaf': 2, 'criterion': 'entropy'}. Best is trial 163 with value: 0.596904761904762.
Trial 203 finished with value: 0.5891666666666666 and parameters: {'n_estimators': 1923, 'max_depth': 1371, 'min_samples_split': 12, 'min_samples_leaf': 2, 'criterion': 'entropy'}. Best is trial 163 with value: 0.596904761904762.
Trial 204 finished with value: 0.576904761904762 and parameters: {'n_estimators': 2047, 'max_depth': 1445, 'min_samples_split': 12, 'min_samples_leaf': 2, 'criterion': 'entropy'}. Best is trial 163 with value: 0.596904761904762.
Trial 205 finished with value: 0.584404761904762 and parameters: {'n_estimators': 1963, 'max_depth': 1344, 'min_samples_split': 13, 'min_samples_leaf': 2, 'criterion': 'entropy'}. Best is trial 163 with value: 0.596904761904762.
Trial 206 finished with value: 0.5944047619047619 and parameters: {'n_estimators': 823, 'max_depth': 1196, 'min_samples_split': 12, 'min_samples_leaf': 3, 'criterion': 'entropy'}. Best is trial 163 with value: 0.596904761904762.
Trial 207 finished with value: 0.5991666666666667 and parameters: {'n_estimators': 834, 'max_depth': 1202, 'min_samples_split': 12, 'min_samples_leaf': 1, 'criterion': 'entropy'}. Best is trial 207 with value: 0.5991666666666667.
Trial 208 finished with value: 0.5917857142857144 and parameters: {'n_estimators': 829, 'max_depth': 1210, 'min_samples_split': 12, 'min_samples_leaf': 1, 'criterion': 'entropy'}. Best is trial 207 with value: 0.5991666666666667.
Trial 209 finished with value: 0.5744047619047619 and parameters: {'n_estimators': 831, 'max_depth': 1185, 'min_samples_split': 12, 'min_samples_leaf': 1, 'criterion': 'entropy'}. Best is trial 207 with value: 0.5991666666666667.
Trial 210 finished with value: 0.5845238095238094 and parameters: {'n_estimators': 780, 'max_depth': 1227, 'min_samples_split': 12, 'min_samples_leaf': 1, 'criterion': 'entropy'}. Best is trial 207 with value: 0.5991666666666667.
Trial 211 finished with value: 0.5796428571428571 and parameters: {'n_estimators': 849, 'max_depth': 1179, 'min_samples_split': 12, 'min_samples_leaf': 1, 'criterion': 'entropy'}. Best is trial 207 with value: 0.5991666666666667.
Trial 212 finished with value: 0.5819047619047619 and parameters: {'n_estimators': 937, 'max_depth': 1256, 'min_samples_split': 12, 'min_samples_leaf': 1, 'criterion': 'entropy'}. Best is trial 207 with value: 0.5991666666666667.
Trial 213 finished with value: 0.5847619047619048 and parameters: {'n_estimators': 824, 'max_depth': 1155, 'min_samples_split': 12, 'min_samples_leaf': 1, 'criterion': 'entropy'}. Best is trial 207 with value: 0.5991666666666667.
Trial 214 finished with value: 0.5869047619047618 and parameters: {'n_estimators': 881, 'max_depth': 1231, 'min_samples_split': 12, 'min_samples_leaf': 1, 'criterion': 'entropy'}. Best is trial 207 with value: 0.5991666666666667.
Trial 215 finished with value: 0.5823809523809524 and parameters: {'n_estimators': 794, 'max_depth': 1203, 'min_samples_split': 12, 'min_samples_leaf': 1, 'criterion': 'entropy'}. Best is trial 207 with value: 0.5991666666666667.
Trial 216 finished with value: 0.5750000000000001 and parameters: {'n_estimators': 747, 'max_depth': 1276, 'min_samples_split': 11, 'min_samples_leaf': 1, 'criterion': 'entropy'}. Best is trial 207 with value: 0.5991666666666667.
Trial 217 finished with value: 0.5821428571428572 and parameters: {'n_estimators': 923, 'max_depth': 1124, 'min_samples_split': 13, 'min_samples_leaf': 1, 'criterion': 'entropy'}. Best is trial 207 with value: 0.5991666666666667.
Trial 218 finished with value: 0.5845238095238096 and parameters: {'n_estimators': 978, 'max_depth': 1826, 'min_samples_split': 11, 'min_samples_leaf': 1, 'criterion': 'entropy'}. Best is trial 207 with value: 0.5991666666666667.
Trial 219 finished with value: 0.5598809523809524 and parameters: {'n_estimators': 714, 'max_depth': 1899, 'min_samples_split': 12, 'min_samples_leaf': 1, 'criterion': 'gini'}. Best is trial 207 with value: 0.5991666666666667.
Trial 220 finished with value: 0.5919047619047619 and parameters: {'n_estimators': 2005, 'max_depth': 1970, 'min_samples_split': 12, 'min_samples_leaf': 1, 'criterion': 'entropy'}. Best is trial 207 with value: 0.5991666666666667.
Trial 221 finished with value: 0.5846428571428572 and parameters: {'n_estimators': 1995, 'max_depth': 1928, 'min_samples_split': 12, 'min_samples_leaf': 1, 'criterion': 'entropy'}. Best is trial 207 with value: 0.5991666666666667.
Trial 222 finished with value: 0.5820238095238095 and parameters: {'n_estimators': 2045, 'max_depth': 2008, 'min_samples_split': 12, 'min_samples_leaf': 1, 'criterion': 'entropy'}. Best is trial 207 with value: 0.5991666666666667.
Trial 223 finished with value: 0.5922619047619048 and parameters: {'n_estimators': 1877, 'max_depth': 1996, 'min_samples_split': 12, 'min_samples_leaf': 1, 'criterion': 'entropy'}. Best is trial 207 with value: 0.5991666666666667.
Trial 224 finished with value: 0.5917857142857144 and parameters: {'n_estimators': 1938, 'max_depth': 1987, 'min_samples_split': 12, 'min_samples_leaf': 1, 'criterion': 'entropy'}. Best is trial 207 with value: 0.5991666666666667.
Trial 225 finished with value: 0.5891666666666666 and parameters: {'n_estimators': 1920, 'max_depth': 2008, 'min_samples_split': 12, 'min_samples_leaf': 1, 'criterion': 'entropy'}. Best is trial 207 with value: 0.5991666666666667.
Trial 226 finished with value: 0.5848809523809524 and parameters: {'n_estimators': 1879, 'max_depth': 1961, 'min_samples_split': 12, 'min_samples_leaf': 1, 'criterion': 'entropy'}. Best is trial 207 with value: 0.5991666666666667.
Trial 227 finished with value: 0.5822619047619048 and parameters: {'n_estimators': 1957, 'max_depth': 1981, 'min_samples_split': 12, 'min_samples_leaf': 1, 'criterion': 'entropy'}. Best is trial 207 with value: 0.5991666666666667.
Trial 228 finished with value: 0.5919047619047619 and parameters: {'n_estimators': 1990, 'max_depth': 1956, 'min_samples_split': 13, 'min_samples_leaf': 1, 'criterion': 'entropy'}. Best is trial 207 with value: 0.5991666666666667.
Trial 229 finished with value: 0.5845238095238094 and parameters: {'n_estimators': 1988, 'max_depth': 1987, 'min_samples_split': 13, 'min_samples_leaf': 1, 'criterion': 'entropy'}. Best is trial 207 with value: 0.5991666666666667.
Trial 230 finished with value: 0.5842857142857143 and parameters: {'n_estimators': 2000, 'max_depth': 1956, 'min_samples_split': 12, 'min_samples_leaf': 1, 'criterion': 'entropy'}. Best is trial 207 with value: 0.5991666666666667.
Trial 231 finished with value: 0.5869047619047619 and parameters: {'n_estimators': 1920, 'max_depth': 2048, 'min_samples_split': 13, 'min_samples_leaf': 1, 'criterion': 'entropy'}. Best is trial 207 with value: 0.5991666666666667.
Trial 232 finished with value: 0.594404761904762 and parameters: {'n_estimators': 1949, 'max_depth': 2001, 'min_samples_split': 13, 'min_samples_leaf': 1, 'criterion': 'entropy'}. Best is trial 207 with value: 0.5991666666666667.
Trial 233 finished with value: 0.5845238095238096 and parameters: {'n_estimators': 1956, 'max_depth': 1938, 'min_samples_split': 13, 'min_samples_leaf': 1, 'criterion': 'entropy'}. Best is trial 207 with value: 0.5991666666666667.
Trial 234 finished with value: 0.5796428571428571 and parameters: {'n_estimators': 2012, 'max_depth': 1998, 'min_samples_split': 12, 'min_samples_leaf': 1, 'criterion': 'entropy'}. Best is trial 207 with value: 0.5991666666666667.
Trial 235 finished with value: 0.5672619047619049 and parameters: {'n_estimators': 1963, 'max_depth': 1951, 'min_samples_split': 12, 'min_samples_leaf': 1, 'criterion': 'entropy'}. Best is trial 207 with value: 0.5991666666666667.
Trial 236 finished with value: 0.5821428571428572 and parameters: {'n_estimators': 1870, 'max_depth': 2023, 'min_samples_split': 13, 'min_samples_leaf': 1, 'criterion': 'entropy'}. Best is trial 207 with value: 0.5991666666666667.
Trial 237 finished with value: 0.5919047619047619 and parameters: {'n_estimators': 2043, 'max_depth': 14, 'min_samples_split': 13, 'min_samples_leaf': 1, 'criterion': 'entropy'}. Best is trial 207 with value: 0.5991666666666667.
Trial 238 finished with value: 0.5869047619047619 and parameters: {'n_estimators': 2016, 'max_depth': 63, 'min_samples_split': 13, 'min_samples_leaf': 1, 'criterion': 'entropy'}. Best is trial 207 with value: 0.5991666666666667.
Trial 239 finished with value: 0.5869047619047619 and parameters: {'n_estimators': 2025, 'max_depth': 1888, 'min_samples_split': 13, 'min_samples_leaf': 1, 'criterion': 'entropy'}. Best is trial 207 with value: 0.5991666666666667.
Trial 240 finished with value: 0.5871428571428573 and parameters: {'n_estimators': 2048, 'max_depth': 374, 'min_samples_split': 13, 'min_samples_leaf': 1, 'criterion': 'entropy'}. Best is trial 207 with value: 0.5991666666666667.
Trial 241 finished with value: 0.5920238095238096 and parameters: {'n_estimators': 1941, 'max_depth': 534, 'min_samples_split': 12, 'min_samples_leaf': 1, 'criterion': 'entropy'}. Best is trial 207 with value: 0.5991666666666667.
Trial 242 finished with value: 0.5820238095238095 and parameters: {'n_estimators': 1969, 'max_depth': 251, 'min_samples_split': 12, 'min_samples_leaf': 1, 'criterion': 'entropy'}. Best is trial 207 with value: 0.5991666666666667.
Trial 243 finished with value: 0.5847619047619048 and parameters: {'n_estimators': 1983, 'max_depth': 1912, 'min_samples_split': 12, 'min_samples_leaf': 1, 'criterion': 'entropy'}. Best is trial 207 with value: 0.5991666666666667.
Trial 244 finished with value: 0.5723809523809524 and parameters: {'n_estimators': 1907, 'max_depth': 1801, 'min_samples_split': 12, 'min_samples_leaf': 1, 'criterion': 'entropy'}. Best is trial 207 with value: 0.5991666666666667.
Trial 245 finished with value: 0.5894047619047619 and parameters: {'n_estimators': 2047, 'max_depth': 677, 'min_samples_split': 13, 'min_samples_leaf': 1, 'criterion': 'entropy'}. Best is trial 207 with value: 0.5991666666666667.
Trial 246 finished with value: 0.5820238095238095 and parameters: {'n_estimators': 1993, 'max_depth': 132, 'min_samples_split': 11, 'min_samples_leaf': 1, 'criterion': 'entropy'}. Best is trial 207 with value: 0.5991666666666667.
Trial 247 finished with value: 0.5871428571428573 and parameters: {'n_estimators': 1943, 'max_depth': 1204, 'min_samples_split': 13, 'min_samples_leaf': 1, 'criterion': 'entropy'}. Best is trial 207 with value: 0.5991666666666667.
Trial 248 finished with value: 0.5821428571428572 and parameters: {'n_estimators': 1991, 'max_depth': 132, 'min_samples_split': 12, 'min_samples_leaf': 1, 'criterion': 'entropy'}. Best is trial 207 with value: 0.5991666666666667.
Trial 249 finished with value: 0.5667857142857142 and parameters: {'n_estimators': 772, 'max_depth': 6, 'min_samples_split': 13, 'min_samples_leaf': 1, 'criterion': 'entropy'}. Best is trial 207 with value: 0.5991666666666667.
Trial 250 finished with value: 0.5894047619047619 and parameters: {'n_estimators': 1886, 'max_depth': 1057, 'min_samples_split': 12, 'min_samples_leaf': 1, 'criterion': 'entropy'}. Best is trial 207 with value: 0.5991666666666667.
Trial 251 finished with value: 0.5747619047619048 and parameters: {'n_estimators': 1942, 'max_depth': 1846, 'min_samples_split': 10, 'min_samples_leaf': 1, 'criterion': 'entropy'}. Best is trial 207 with value: 0.5991666666666667.
Trial 252 finished with value: 0.5895238095238096 and parameters: {'n_estimators': 631, 'max_depth': 664, 'min_samples_split': 11, 'min_samples_leaf': 1, 'criterion': 'entropy'}. Best is trial 207 with value: 0.5991666666666667.
Trial 253 finished with value: 0.5870238095238095 and parameters: {'n_estimators': 420, 'max_depth': 463, 'min_samples_split': 12, 'min_samples_leaf': 1, 'criterion': 'entropy'}. Best is trial 207 with value: 0.5991666666666667.
Trial 254 finished with value: 0.589404761904762 and parameters: {'n_estimators': 887, 'max_depth': 1941, 'min_samples_split': 13, 'min_samples_leaf': 1, 'criterion': 'entropy'}. Best is trial 207 with value: 0.5991666666666667.
Trial 255 finished with value: 0.584404761904762 and parameters: {'n_estimators': 1070, 'max_depth': 623, 'min_samples_split': 12, 'min_samples_leaf': 1, 'criterion': 'entropy'}. Best is trial 207 with value: 0.5991666666666667.
Trial 256 finished with value: 0.5723809523809524 and parameters: {'n_estimators': 2046, 'max_depth': 2029, 'min_samples_split': 11, 'min_samples_leaf': 1, 'criterion': 'gini'}. Best is trial 207 with value: 0.5991666666666667.
Trial 257 finished with value: 0.5595238095238095 and parameters: {'n_estimators': 818, 'max_depth': 1143, 'min_samples_split': 8, 'min_samples_leaf': 8, 'criterion': 'entropy'}. Best is trial 207 with value: 0.5991666666666667.
Trial 258 finished with value: 0.589404761904762 and parameters: {'n_estimators': 1999, 'max_depth': 1258, 'min_samples_split': 12, 'min_samples_leaf': 1, 'criterion': 'entropy'}. Best is trial 207 with value: 0.5991666666666667.
Trial 259 finished with value: 0.5698809523809525 and parameters: {'n_estimators': 692, 'max_depth': 1307, 'min_samples_split': 7, 'min_samples_leaf': 2, 'criterion': 'entropy'}. Best is trial 207 with value: 0.5991666666666667.
Trial 260 finished with value: 0.5772619047619048 and parameters: {'n_estimators': 1848, 'max_depth': 1901, 'min_samples_split': 10, 'min_samples_leaf': 1, 'criterion': 'entropy'}. Best is trial 207 with value: 0.5991666666666667.
Trial 261 finished with value: 0.5845238095238096 and parameters: {'n_estimators': 735, 'max_depth': 1801, 'min_samples_split': 12, 'min_samples_leaf': 1, 'criterion': 'entropy'}. Best is trial 207 with value: 0.5991666666666667.
Trial 262 finished with value: 0.5796428571428571 and parameters: {'n_estimators': 799, 'max_depth': 235, 'min_samples_split': 9, 'min_samples_leaf': 1, 'criterion': 'entropy'}. Best is trial 207 with value: 0.5991666666666667.
Trial 263 finished with value: 0.5771428571428572 and parameters: {'n_estimators': 1964, 'max_depth': 1966, 'min_samples_split': 10, 'min_samples_leaf': 1, 'criterion': 'entropy'}. Best is trial 207 with value: 0.5991666666666667.
Trial 264 finished with value: 0.5895238095238096 and parameters: {'n_estimators': 1808, 'max_depth': 974, 'min_samples_split': 13, 'min_samples_leaf': 1, 'criterion': 'entropy'}. Best is trial 207 with value: 0.5991666666666667.
Trial 265 finished with value: 0.574404761904762 and parameters: {'n_estimators': 869, 'max_depth': 1167, 'min_samples_split': 2, 'min_samples_leaf': 1, 'criterion': 'entropy'}. Best is trial 207 with value: 0.5991666666666667.
Trial 266 finished with value: 0.5846428571428571 and parameters: {'n_estimators': 1930, 'max_depth': 1226, 'min_samples_split': 11, 'min_samples_leaf': 2, 'criterion': 'entropy'}. Best is trial 207 with value: 0.5991666666666667.
Trial 267 finished with value: 0.5844047619047619 and parameters: {'n_estimators': 1999, 'max_depth': 1089, 'min_samples_split': 12, 'min_samples_leaf': 1, 'criterion': 'entropy'}. Best is trial 207 with value: 0.5991666666666667.
Trial 268 finished with value: 0.5795238095238096 and parameters: {'n_estimators': 952, 'max_depth': 1864, 'min_samples_split': 13, 'min_samples_leaf': 1, 'criterion': 'entropy'}. Best is trial 207 with value: 0.5991666666666667.
Trial 269 finished with value: 0.5769047619047619 and parameters: {'n_estimators': 1021, 'max_depth': 2016, 'min_samples_split': 12, 'min_samples_leaf': 1, 'criterion': 'entropy'}. Best is trial 207 with value: 0.5991666666666667.
Trial 270 finished with value: 0.5820238095238095 and parameters: {'n_estimators': 1467, 'max_depth': 1770, 'min_samples_split': 11, 'min_samples_leaf': 1, 'criterion': 'entropy'}. Best is trial 207 with value: 0.5991666666666667.
Trial 271 finished with value: 0.5771428571428572 and parameters: {'n_estimators': 760, 'max_depth': 587, 'min_samples_split': 12, 'min_samples_leaf': 1, 'criterion': 'entropy'}. Best is trial 207 with value: 0.5991666666666667.
Trial 272 finished with value: 0.5821428571428572 and parameters: {'n_estimators': 657, 'max_depth': 569, 'min_samples_split': 10, 'min_samples_leaf': 1, 'criterion': 'entropy'}. Best is trial 207 with value: 0.5991666666666667.
Trial 273 finished with value: 0.5919047619047619 and parameters: {'n_estimators': 2016, 'max_depth': 1715, 'min_samples_split': 11, 'min_samples_leaf': 2, 'criterion': 'entropy'}. Best is trial 207 with value: 0.5991666666666667.
Trial 274 finished with value: 0.5842857142857144 and parameters: {'n_estimators': 2015, 'max_depth': 1801, 'min_samples_split': 11, 'min_samples_leaf': 2, 'criterion': 'gini'}. Best is trial 207 with value: 0.5991666666666667.
Trial 275 finished with value: 0.5917857142857142 and parameters: {'n_estimators': 2045, 'max_depth': 1734, 'min_samples_split': 10, 'min_samples_leaf': 2, 'criterion': 'entropy'}. Best is trial 207 with value: 0.5991666666666667.
Trial 276 finished with value: 0.5844047619047619 and parameters: {'n_estimators': 324, 'max_depth': 438, 'min_samples_split': 10, 'min_samples_leaf': 2, 'criterion': 'entropy'}. Best is trial 207 with value: 0.5991666666666667.
Trial 277 finished with value: 0.5867857142857142 and parameters: {'n_estimators': 1966, 'max_depth': 1724, 'min_samples_split': 11, 'min_samples_leaf': 2, 'criterion': 'entropy'}. Best is trial 207 with value: 0.5991666666666667.
Trial 278 finished with value: 0.5819047619047619 and parameters: {'n_estimators': 1902, 'max_depth': 1689, 'min_samples_split': 13, 'min_samples_leaf': 2, 'criterion': 'entropy'}. Best is trial 207 with value: 0.5991666666666667.
Trial 279 finished with value: 0.5821428571428572 and parameters: {'n_estimators': 1992, 'max_depth': 1840, 'min_samples_split': 9, 'min_samples_leaf': 2, 'criterion': 'entropy'}. Best is trial 207 with value: 0.5991666666666667.
Trial 280 finished with value: 0.581547619047619 and parameters: {'n_estimators': 502, 'max_depth': 1904, 'min_samples_split': 10, 'min_samples_leaf': 6, 'criterion': 'entropy'}. Best is trial 207 with value: 0.5991666666666667.
Trial 281 finished with value: 0.5895238095238096 and parameters: {'n_estimators': 1945, 'max_depth': 1972, 'min_samples_split': 11, 'min_samples_leaf': 1, 'criterion': 'entropy'}. Best is trial 207 with value: 0.5991666666666667.
Trial 282 finished with value: 0.5820238095238095 and parameters: {'n_estimators': 2046, 'max_depth': 1770, 'min_samples_split': 13, 'min_samples_leaf': 1, 'criterion': 'entropy'}. Best is trial 207 with value: 0.5991666666666667.
Trial 283 finished with value: 0.5747619047619048 and parameters: {'n_estimators': 576, 'max_depth': 911, 'min_samples_split': 9, 'min_samples_leaf': 2, 'criterion': 'entropy'}. Best is trial 207 with value: 0.5991666666666667.
Trial 284 finished with value: 0.5820238095238095 and parameters: {'n_estimators': 2005, 'max_depth': 1820, 'min_samples_split': 12, 'min_samples_leaf': 1, 'criterion': 'entropy'}. Best is trial 207 with value: 0.5991666666666667.
Trial 285 finished with value: 0.5869047619047619 and parameters: {'n_estimators': 1523, 'max_depth': 1938, 'min_samples_split': 13, 'min_samples_leaf': 1, 'criterion': 'entropy'}. Best is trial 207 with value: 0.5991666666666667.
