Trial 476 finished with value: 0.5942857142857144 and parameters: {'n_estimators': 1239, 'max_depth': 1507, 'min_samples_split': 10, 'min_samples_leaf': 2, 'criterion': 'entropy'}. Best is trial 374 with value: 0.6066666666666667.
Trial 477 finished with value: 0.5867857142857144 and parameters: {'n_estimators': 1109, 'max_depth': 963, 'min_samples_split': 10, 'min_samples_leaf': 2, 'criterion': 'gini'}. Best is trial 374 with value: 0.6066666666666667.
Trial 478 finished with value: 0.5795238095238094 and parameters: {'n_estimators': 1195, 'max_depth': 1419, 'min_samples_split': 9, 'min_samples_leaf': 3, 'criterion': 'entropy'}. Best is trial 374 with value: 0.6066666666666667.
Trial 479 finished with value: 0.5791666666666667 and parameters: {'n_estimators': 1041, 'max_depth': 1013, 'min_samples_split': 10, 'min_samples_leaf': 3, 'criterion': 'entropy'}. Best is trial 374 with value: 0.6066666666666667.
Trial 480 finished with value: 0.5917857142857142 and parameters: {'n_estimators': 1155, 'max_depth': 1589, 'min_samples_split': 11, 'min_samples_leaf': 2, 'criterion': 'entropy'}. Best is trial 374 with value: 0.6066666666666667.
Trial 481 finished with value: 0.5795238095238096 and parameters: {'n_estimators': 1288, 'max_depth': 1466, 'min_samples_split': 9, 'min_samples_leaf': 2, 'criterion': 'entropy'}. Best is trial 374 with value: 0.6066666666666667.
Trial 482 finished with value: 0.5822619047619049 and parameters: {'n_estimators': 1080, 'max_depth': 1364, 'min_samples_split': 10, 'min_samples_leaf': 2, 'criterion': 'entropy'}. Best is trial 374 with value: 0.6066666666666667.
Trial 483 finished with value: 0.5869047619047619 and parameters: {'n_estimators': 1232, 'max_depth': 1648, 'min_samples_split': 10, 'min_samples_leaf': 2, 'criterion': 'entropy'}. Best is trial 374 with value: 0.6066666666666667.
Trial 484 finished with value: 0.5845238095238096 and parameters: {'n_estimators': 1106, 'max_depth': 1508, 'min_samples_split': 10, 'min_samples_leaf': 2, 'criterion': 'entropy'}. Best is trial 374 with value: 0.6066666666666667.
Trial 485 finished with value: 0.5819047619047619 and parameters: {'n_estimators': 1023, 'max_depth': 1555, 'min_samples_split': 11, 'min_samples_leaf': 2, 'criterion': 'entropy'}. Best is trial 374 with value: 0.6066666666666667.
Trial 486 finished with value: 0.5748809523809524 and parameters: {'n_estimators': 1350, 'max_depth': 1325, 'min_samples_split': 9, 'min_samples_leaf': 2, 'criterion': 'entropy'}. Best is trial 374 with value: 0.6066666666666667.
Trial 487 finished with value: 0.5845238095238094 and parameters: {'n_estimators': 1191, 'max_depth': 1446, 'min_samples_split': 10, 'min_samples_leaf': 2, 'criterion': 'entropy'}. Best is trial 374 with value: 0.6066666666666667.
Trial 488 finished with value: 0.5921428571428572 and parameters: {'n_estimators': 1145, 'max_depth': 935, 'min_samples_split': 10, 'min_samples_leaf': 2, 'criterion': 'entropy'}. Best is trial 374 with value: 0.6066666666666667.
Trial 489 finished with value: 0.5895238095238095 and parameters: {'n_estimators': 1251, 'max_depth': 1484, 'min_samples_split': 8, 'min_samples_leaf': 2, 'criterion': 'entropy'}. Best is trial 374 with value: 0.6066666666666667.
Trial 490 finished with value: 0.5820238095238096 and parameters: {'n_estimators': 1303, 'max_depth': 1396, 'min_samples_split': 9, 'min_samples_leaf': 2, 'criterion': 'entropy'}. Best is trial 374 with value: 0.6066666666666667.
Trial 491 finished with value: 0.5917857142857142 and parameters: {'n_estimators': 1120, 'max_depth': 1626, 'min_samples_split': 11, 'min_samples_leaf': 2, 'criterion': 'entropy'}. Best is trial 374 with value: 0.6066666666666667.
Trial 492 finished with value: 0.5845238095238094 and parameters: {'n_estimators': 1210, 'max_depth': 1525, 'min_samples_split': 10, 'min_samples_leaf': 2, 'criterion': 'entropy'}. Best is trial 374 with value: 0.6066666666666667.
Trial 493 finished with value: 0.5747619047619048 and parameters: {'n_estimators': 1058, 'max_depth': 1432, 'min_samples_split': 10, 'min_samples_leaf': 2, 'criterion': 'entropy'}. Best is trial 374 with value: 0.6066666666666667.
Trial 494 finished with value: 0.5797619047619047 and parameters: {'n_estimators': 1172, 'max_depth': 1480, 'min_samples_split': 9, 'min_samples_leaf': 2, 'criterion': 'entropy'}. Best is trial 374 with value: 0.6066666666666667.
Trial 495 finished with value: 0.579404761904762 and parameters: {'n_estimators': 1380, 'max_depth': 1568, 'min_samples_split': 10, 'min_samples_leaf': 2, 'criterion': 'entropy'}. Best is trial 374 with value: 0.6066666666666667.
Trial 496 finished with value: 0.5842857142857143 and parameters: {'n_estimators': 1267, 'max_depth': 888, 'min_samples_split': 11, 'min_samples_leaf': 2, 'criterion': 'gini'}. Best is trial 374 with value: 0.6066666666666667.
Trial 497 finished with value: 0.5845238095238094 and parameters: {'n_estimators': 1092, 'max_depth': 1420, 'min_samples_split': 10, 'min_samples_leaf': 2, 'criterion': 'entropy'}. Best is trial 374 with value: 0.6066666666666667.
Trial 498 finished with value: 0.596547619047619 and parameters: {'n_estimators': 1137, 'max_depth': 1679, 'min_samples_split': 9, 'min_samples_leaf': 2, 'criterion': 'entropy'}. Best is trial 374 with value: 0.6066666666666667.
Trial 499 finished with value: 0.5820238095238095 and parameters: {'n_estimators': 1000, 'max_depth': 1517, 'min_samples_split': 10, 'min_samples_leaf': 2, 'criterion': 'entropy'}. Best is trial 374 with value: 0.6066666666666667.
