Trial 475 finished with value: 0.5766666666666667 and parameters: {'n_estimators': 451, 'criterion': 'log_loss', 'max_features': 206, 'min_samples_split': 63, 'min_samples_leaf': 8}. Best is trial 13 with value: 0.6138095238095238.
Trial 476 finished with value: 0.5840476190476189 and parameters: {'n_estimators': 113, 'criterion': 'log_loss', 'max_features': 758, 'min_samples_split': 25, 'min_samples_leaf': 3}. Best is trial 13 with value: 0.6138095238095238.
Trial 477 finished with value: 0.5816666666666666 and parameters: {'n_estimators': 410, 'criterion': 'log_loss', 'max_features': 50, 'min_samples_split': 32, 'min_samples_leaf': 4}. Best is trial 13 with value: 0.6138095238095238.
Trial 478 finished with value: 0.5716666666666665 and parameters: {'n_estimators': 145, 'criterion': 'log_loss', 'max_features': 73, 'min_samples_split': 9, 'min_samples_leaf': 9}. Best is trial 13 with value: 0.6138095238095238.
Trial 479 finished with value: 0.589047619047619 and parameters: {'n_estimators': 212, 'criterion': 'log_loss', 'max_features': 228, 'min_samples_split': 30, 'min_samples_leaf': 7}. Best is trial 13 with value: 0.6138095238095238.
Trial 480 finished with value: 0.579047619047619 and parameters: {'n_estimators': 353, 'criterion': 'log_loss', 'max_features': 539, 'min_samples_split': 3, 'min_samples_leaf': 2}. Best is trial 13 with value: 0.6138095238095238.
Trial 481 finished with value: 0.5944047619047619 and parameters: {'n_estimators': 478, 'criterion': 'log_loss', 'max_features': 258, 'min_samples_split': 13, 'min_samples_leaf': 1}. Best is trial 13 with value: 0.6138095238095238.
Trial 482 finished with value: 0.5841666666666667 and parameters: {'n_estimators': 271, 'criterion': 'log_loss', 'max_features': 96, 'min_samples_split': 20, 'min_samples_leaf': 5}. Best is trial 13 with value: 0.6138095238095238.
Trial 483 finished with value: 0.5842857142857142 and parameters: {'n_estimators': 154, 'criterion': 'log_loss', 'max_features': 85, 'min_samples_split': 65, 'min_samples_leaf': 4}. Best is trial 13 with value: 0.6138095238095238.
Trial 484 finished with value: 0.5940476190476189 and parameters: {'n_estimators': 292, 'criterion': 'log_loss', 'max_features': 174, 'min_samples_split': 40, 'min_samples_leaf': 1}. Best is trial 13 with value: 0.6138095238095238.
Trial 485 finished with value: 0.5966666666666667 and parameters: {'n_estimators': 425, 'criterion': 'log_loss', 'max_features': 242, 'min_samples_split': 17, 'min_samples_leaf': 4}. Best is trial 13 with value: 0.6138095238095238.
Trial 486 finished with value: 0.5967857142857141 and parameters: {'n_estimators': 225, 'criterion': 'entropy', 'max_features': 193, 'min_samples_split': 28, 'min_samples_leaf': 5}. Best is trial 13 with value: 0.6138095238095238.
Trial 487 finished with value: 0.5916666666666666 and parameters: {'n_estimators': 462, 'criterion': 'log_loss', 'max_features': 368, 'min_samples_split': 15, 'min_samples_leaf': 4}. Best is trial 13 with value: 0.6138095238095238.
Trial 488 finished with value: 0.5916666666666666 and parameters: {'n_estimators': 379, 'criterion': 'log_loss', 'max_features': 106, 'min_samples_split': 23, 'min_samples_leaf': 6}. Best is trial 13 with value: 0.6138095238095238.
Trial 489 finished with value: 0.5889285714285715 and parameters: {'n_estimators': 200, 'criterion': 'log_loss', 'max_features': 149, 'min_samples_split': 33, 'min_samples_leaf': 1}. Best is trial 13 with value: 0.6138095238095238.
Trial 490 finished with value: 0.5916666666666666 and parameters: {'n_estimators': 190, 'criterion': 'log_loss', 'max_features': 77, 'min_samples_split': 26, 'min_samples_leaf': 3}. Best is trial 13 with value: 0.6138095238095238.
Trial 491 finished with value: 0.5866666666666667 and parameters: {'n_estimators': 263, 'criterion': 'entropy', 'max_features': 133, 'min_samples_split': 12, 'min_samples_leaf': 1}. Best is trial 13 with value: 0.6138095238095238.
Trial 492 finished with value: 0.5942857142857142 and parameters: {'n_estimators': 392, 'criterion': 'log_loss', 'max_features': 331, 'min_samples_split': 18, 'min_samples_leaf': 2}. Best is trial 13 with value: 0.6138095238095238.
Trial 493 finished with value: 0.5989285714285715 and parameters: {'n_estimators': 488, 'criterion': 'log_loss', 'max_features': 218, 'min_samples_split': 14, 'min_samples_leaf': 3}. Best is trial 13 with value: 0.6138095238095238.
Trial 494 finished with value: 0.5895238095238096 and parameters: {'n_estimators': 105, 'criterion': 'log_loss', 'max_features': 299, 'min_samples_split': 36, 'min_samples_leaf': 4}. Best is trial 13 with value: 0.6138095238095238.
Trial 495 finished with value: 0.5791666666666666 and parameters: {'n_estimators': 281, 'criterion': 'gini', 'max_features': 163, 'min_samples_split': 29, 'min_samples_leaf': 1}. Best is trial 13 with value: 0.6138095238095238.
Trial 496 finished with value: 0.5745238095238095 and parameters: {'n_estimators': 208, 'criterion': 'log_loss', 'max_features': 266, 'min_samples_split': 54, 'min_samples_leaf': 4}. Best is trial 13 with value: 0.6138095238095238.
Trial 497 finished with value: 0.5796428571428571 and parameters: {'n_estimators': 182, 'criterion': 'entropy', 'max_features': 99, 'min_samples_split': 21, 'min_samples_leaf': 1}. Best is trial 13 with value: 0.6138095238095238.
Trial 498 finished with value: 0.5641666666666667 and parameters: {'n_estimators': 439, 'criterion': 'log_loss', 'max_features': 83, 'min_samples_split': 82, 'min_samples_leaf': 4}. Best is trial 13 with value: 0.6138095238095238.
Trial 499 finished with value: 0.591547619047619 and parameters: {'n_estimators': 219, 'criterion': 'log_loss', 'max_features': 122, 'min_samples_split': 15, 'min_samples_leaf': 2}. Best is trial 13 with value: 0.6138095238095238.